{
  "candidate_id": "PUBLIC_REHEARSAL_AUTOMATIC",
  "content_class": "PUBLIC_REHEARSAL_NOT_OFFICIAL",
  "instance_id": "PUBLIC-REHEARSAL-AUTOMATIC-INSTANCE",
  "mission_id": "public-rehearsal-automatic",
  "operator_run_token": "PUBLIC_REHEARSAL_AUTOGENERATED",
  "probe_contract_profile": "DACON_SIGNED_RUNNER_PROTECTED_COMPONENT_V3_DRAFT",
  "probe_pack_id": "PUBLIC-REHEARSAL-13-OPS-V1-V3",
  "release_attestation_id": "ra-v1:97813d4132b579f859ec2f32a7891a21fe1a806159c3074dfce527ee514e1b2d",
  "request_nonce": "PUBLIC_REHEARSAL_AUTOGENERATED",
  "schema_version": "3.0.0-draft",
  "steps": [
    {
      "event_id": "EVENT-V3-01-RESET_AND_START",
      "operation": "RESET_AND_START",
      "roles": {},
      "session_id": "V3-SESSION-A",
      "step_id": "V3-01",
      "virtual_time": "2026-02-01T00:01:00Z"
    },
    {
      "event_id": "EVENT-V3-02-UPSERT_FACT",
      "operation": "UPSERT_FACT",
      "roles": {
        "CURRENT_AUTHORITY": "v3-authority-v1",
        "PRESERVED_SCOPE": "v3-scope-keep",
        "PRIMARY_GOAL": "v3-goal",
        "STABLE_VALUE": "v3-stable-1",
        "TARGET_ENTITY": "v3-entity-1"
      },
      "session_id": "V3-SESSION-A",
      "step_id": "V3-02",
      "virtual_time": "2026-02-01T00:02:00Z"
    },
    {
      "event_id": "EVENT-V3-03-REQUEST_DECISION",
      "operation": "REQUEST_DECISION",
      "roles": {
        "PRIMARY_GOAL": "v3-goal",
        "TARGET_ENTITY": "v3-entity-1"
      },
      "session_id": "V3-SESSION-A",
      "step_id": "V3-03",
      "virtual_time": "2026-02-01T00:03:00Z"
    },
    {
      "event_id": "EVENT-V3-04-REQUEST_DECISION",
      "operation": "REQUEST_DECISION",
      "roles": {
        "PRIMARY_GOAL": "v3-goal",
        "TARGET_ENTITY": "v3-entity-1"
      },
      "session_id": "V3-SESSION-A",
      "step_id": "V3-04",
      "virtual_time": "2026-02-01T00:04:00Z"
    },
    {
      "event_id": "EVENT-V3-05-SET_NETWORK",
      "operation": "SET_NETWORK",
      "roles": {
        "NETWORK_STATE": "OFFLINE"
      },
      "session_id": "V3-SESSION-A",
      "step_id": "V3-05",
      "virtual_time": "2026-02-01T00:05:00Z"
    },
    {
      "event_id": "EVENT-V3-06-REQUEST_DECISION",
      "operation": "REQUEST_DECISION",
      "roles": {
        "PRIMARY_GOAL": "v3-goal",
        "TARGET_ENTITY": "v3-entity-1"
      },
      "session_id": "V3-SESSION-A",
      "step_id": "V3-06",
      "virtual_time": "2026-02-01T00:06:00Z"
    },
    {
      "event_id": "EVENT-V3-07-SET_NETWORK",
      "operation": "SET_NETWORK",
      "roles": {
        "NETWORK_STATE": "ONLINE"
      },
      "session_id": "V3-SESSION-A",
      "step_id": "V3-07",
      "virtual_time": "2026-02-01T00:07:00Z"
    },
    {
      "event_id": "EVENT-V3-08-REQUEST_DECISION",
      "operation": "REQUEST_DECISION",
      "roles": {
        "PRIMARY_GOAL": "v3-goal",
        "TARGET_ENTITY": "v3-entity-1"
      },
      "session_id": "V3-SESSION-A",
      "step_id": "V3-08",
      "virtual_time": "2026-02-01T00:08:00Z"
    },
    {
      "event_id": "EVENT-V3-09-ADVANCE_SESSION",
      "operation": "ADVANCE_SESSION",
      "roles": {
        "PRIMARY_GOAL": "v3-goal",
        "TARGET_ENTITY": "v3-entity-1"
      },
      "session_id": "V3-SESSION-B",
      "step_id": "V3-09",
      "virtual_time": "2026-02-01T00:09:00Z"
    },
    {
      "event_id": "EVENT-V3-10-CORRECT_FACT",
      "operation": "CORRECT_FACT",
      "roles": {
        "CURRENT_AUTHORITY": "v3-authority-v2",
        "ONE_OFF_VALUE": "v3-corrected",
        "PRESERVED_SCOPE": "v3-scope-keep",
        "TARGET_ENTITY": "v3-entity-1"
      },
      "session_id": "V3-SESSION-B",
      "step_id": "V3-10",
      "virtual_time": "2026-02-01T00:10:00Z"
    },
    {
      "event_id": "EVENT-V3-11-REQUEST_DECISION",
      "operation": "REQUEST_DECISION",
      "roles": {
        "PRIMARY_GOAL": "v3-goal",
        "TARGET_ENTITY": "v3-entity-1"
      },
      "session_id": "V3-SESSION-B",
      "step_id": "V3-11",
      "virtual_time": "2026-02-01T00:11:00Z"
    },
    {
      "event_id": "EVENT-V3-12-REVOKE_SCOPE",
      "operation": "REVOKE_SCOPE",
      "roles": {
        "PRESERVED_SCOPE": "v3-scope-keep",
        "REVOKED_SCOPE": "v3-scope-revoke"
      },
      "session_id": "V3-SESSION-B",
      "step_id": "V3-12",
      "virtual_time": "2026-02-01T00:12:00Z"
    },
    {
      "event_id": "EVENT-V3-13-REQUEST_DECISION",
      "operation": "REQUEST_DECISION",
      "roles": {
        "PRIMARY_GOAL": "v3-goal",
        "TARGET_ENTITY": "v3-entity-1"
      },
      "session_id": "V3-SESSION-B",
      "step_id": "V3-13",
      "virtual_time": "2026-02-01T00:13:00Z"
    },
    {
      "event_id": "EVENT-V3-14-RESET_AND_START",
      "operation": "RESET_AND_START",
      "roles": {},
      "session_id": "V3-SESSION-C",
      "step_id": "V3-14",
      "virtual_time": "2026-02-01T00:14:00Z"
    },
    {
      "event_id": "EVENT-V3-15-UPSERT_FACT",
      "operation": "UPSERT_FACT",
      "roles": {
        "CURRENT_AUTHORITY": "v3-authority-v3",
        "PRESERVED_SCOPE": "v3-scope-second-run",
        "PRIMARY_GOAL": "v3-goal-second",
        "STABLE_VALUE": "v3-stable-2",
        "TARGET_ENTITY": "v3-entity-2"
      },
      "session_id": "V3-SESSION-C",
      "step_id": "V3-15",
      "virtual_time": "2026-02-01T00:15:00Z"
    },
    {
      "event_id": "EVENT-V3-16-REQUEST_DECISION",
      "operation": "REQUEST_DECISION",
      "roles": {
        "PRIMARY_GOAL": "v3-goal-second",
        "TARGET_ENTITY": "v3-entity-2"
      },
      "session_id": "V3-SESSION-C",
      "step_id": "V3-16",
      "virtual_time": "2026-02-01T00:16:00Z"
    },
    {
      "event_id": "EVENT-V3-17-PROCESS_KILL_RELAUNCH",
      "operation": "PROCESS_KILL_RELAUNCH",
      "roles": {},
      "session_id": "V3-SESSION-D",
      "step_id": "V3-17",
      "virtual_time": "2026-02-01T00:17:00Z"
    },
    {
      "event_id": "EVENT-V3-18-EXPORT_AND_END",
      "operation": "EXPORT_AND_END",
      "roles": {},
      "session_id": "V3-SESSION-D",
      "step_id": "V3-18",
      "virtual_time": "2026-02-01T00:18:00Z"
    }
  ],
  "surface_nonce": "PUBLIC_REHEARSAL_SURFACE_A"
}
