{
  "candidate_id": "PUBLIC_REHEARSAL_AUTOMATIC",
  "content_class": "PUBLIC_REHEARSAL_NOT_OFFICIAL",
  "instance_id": "PUBLIC-REHEARSAL-AUTOMATIC-INSTANCE",
  "mission_id": "public-rehearsal-automatic",
  "operator_run_token": "PUBLIC_REHEARSAL_AUTOGENERATED",
  "probe_contract_profile": "DACON_SIGNED_RUNNER_PROTECTED_COMPONENT_V3_DRAFT",
  "probe_pack_id": "PUBLIC-REHEARSAL-13-OPS-V1",
  "release_attestation_id": "ra-v1:97813d4132b579f859ec2f32a7891a21fe1a806159c3074dfce527ee514e1b2d",
  "request_nonce": "PUBLIC_REHEARSAL_AUTOGENERATED",
  "schema_version": "3.0.0-draft",
  "steps": [
    {
      "event_id": "EVENT-PUBLIC-RESET-01",
      "operation": "RESET_AND_START",
      "roles": {},
      "session_id": "SESSION-A",
      "step_id": "PUBLIC-01",
      "virtual_time": "2026-01-01T00:00:00Z"
    },
    {
      "event_id": "EVENT-PUBLIC-FACT-01",
      "operation": "UPSERT_FACT",
      "roles": {
        "CURRENT_AUTHORITY": "PUBLIC_AUTHORITY_V1",
        "ONE_OFF_VALUE": "PUBLIC_ONCE_MORNING",
        "PRESERVED_SCOPE": "PUBLIC_SCOPE_KEEP",
        "PRIMARY_GOAL": "PUBLIC_GOAL_ALPHA",
        "STABLE_VALUE": "PUBLIC_STABLE_BLUE",
        "TARGET_ENTITY": "PUBLIC_ENTITY_A"
      },
      "session_id": "SESSION-A",
      "step_id": "PUBLIC-02",
      "virtual_time": "2026-01-01T00:01:00Z"
    },
    {
      "event_id": "EVENT-PUBLIC-SESSION-01",
      "operation": "ADVANCE_SESSION",
      "roles": {
        "DISTRACTOR_ENTITY": "PUBLIC_ENTITY_B",
        "PRIMARY_GOAL": "PUBLIC_GOAL_ALPHA",
        "TARGET_ENTITY": "PUBLIC_ENTITY_A"
      },
      "session_id": "SESSION-B",
      "step_id": "PUBLIC-03",
      "virtual_time": "2026-01-01T00:02:00Z"
    },
    {
      "event_id": "EVENT-PUBLIC-DECISION-01",
      "operation": "REQUEST_DECISION",
      "roles": {
        "PRIMARY_GOAL": "PUBLIC_GOAL_ALPHA",
        "TARGET_ENTITY": "PUBLIC_ENTITY_A"
      },
      "session_id": "SESSION-B",
      "step_id": "PUBLIC-04",
      "virtual_time": "2026-01-01T00:03:00Z"
    },
    {
      "event_id": "EVENT-PUBLIC-CORRECT-01",
      "operation": "CORRECT_FACT",
      "roles": {
        "CURRENT_AUTHORITY": "PUBLIC_AUTHORITY_V2",
        "ONE_OFF_VALUE": "PUBLIC_CORRECTED_GREEN",
        "PRESERVED_SCOPE": "PUBLIC_SCOPE_KEEP",
        "TARGET_ENTITY": "PUBLIC_ENTITY_A"
      },
      "session_id": "SESSION-B",
      "step_id": "PUBLIC-05",
      "virtual_time": "2026-01-01T00:04:00Z"
    },
    {
      "event_id": "EVENT-PUBLIC-REVOKE-01",
      "operation": "REVOKE_SCOPE",
      "roles": {
        "PRESERVED_SCOPE": "PUBLIC_SCOPE_KEEP",
        "REVOKED_SCOPE": "PUBLIC_SCOPE_REVOKE"
      },
      "session_id": "SESSION-B",
      "step_id": "PUBLIC-06",
      "virtual_time": "2026-01-01T00:05:00Z"
    },
    {
      "event_id": "EVENT-PUBLIC-DELETE-01",
      "operation": "DELETE_FACT",
      "roles": {
        "TARGET_ENTITY": "PUBLIC_ENTITY_A"
      },
      "session_id": "SESSION-B",
      "step_id": "PUBLIC-07",
      "virtual_time": "2026-01-01T00:06:00Z"
    },
    {
      "event_id": "EVENT-PUBLIC-NETWORK-01",
      "operation": "SET_NETWORK",
      "roles": {
        "NETWORK_STATE": "OFFLINE",
        "ONE_OFF_VALUE": "OFFLINE"
      },
      "session_id": "SESSION-B",
      "step_id": "PUBLIC-08",
      "virtual_time": "2026-01-01T00:07:00Z"
    },
    {
      "event_id": "EVENT-PUBLIC-KILL-01",
      "operation": "PROCESS_KILL_RELAUNCH",
      "roles": {},
      "session_id": "SESSION-C",
      "step_id": "PUBLIC-09",
      "virtual_time": "2026-01-01T00:08:00Z"
    },
    {
      "event_id": "EVENT-PUBLIC-REPLAY-01",
      "operation": "REPLAY_EVENT",
      "roles": {
        "REPLAY_OF_EVENT_ID": "EVENT-PUBLIC-DECISION-01"
      },
      "session_id": "SESSION-C",
      "step_id": "PUBLIC-10",
      "virtual_time": "2026-01-01T00:09:00Z"
    },
    {
      "event_id": "EVENT-PUBLIC-OUT-OF-ORDER-01",
      "operation": "DELIVER_OUT_OF_ORDER",
      "roles": {
        "CURRENT_AUTHORITY": "PUBLIC_AUTHORITY_V2",
        "OLDER_EVENT_ID": "EVENT-PUBLIC-FACT-01"
      },
      "session_id": "SESSION-C",
      "step_id": "PUBLIC-11",
      "virtual_time": "2026-01-01T00:10:00Z"
    },
    {
      "event_id": "EVENT-PUBLIC-TIME-01",
      "operation": "ADVANCE_TIME",
      "roles": {
        "DELAYED_OUTCOME": "PUBLIC_DELAYED_OUTCOME_ARRIVED"
      },
      "session_id": "SESSION-C",
      "step_id": "PUBLIC-12",
      "virtual_time": "2026-01-08T00:10:00Z"
    },
    {
      "event_id": "EVENT-PUBLIC-EXPORT-01",
      "operation": "EXPORT_AND_END",
      "roles": {},
      "session_id": "SESSION-C",
      "step_id": "PUBLIC-13",
      "virtual_time": "2026-01-08T00:11:00Z"
    }
  ],
  "surface_nonce": "PUBLIC_REHEARSAL_SURFACE_A"
}
