{
  "candidate_id": "PUBLIC_REHEARSAL_AUTOMATIC",
  "content_class": "PUBLIC_REHEARSAL_NOT_OFFICIAL",
  "instance_id": "PUBLIC-REHEARSAL-AUTOMATIC-INSTANCE",
  "mission_id": "public-rehearsal-automatic",
  "operator_run_token": "PUBLIC_REHEARSAL_AUTOGENERATED",
  "probe_contract_profile": "DACON_SIGNED_RUNNER_PROTECTED_COMPONENT_V3_DRAFT",
  "probe_pack_id": "PUBLIC-REHEARSAL-13-OPS-V1-V2",
  "release_attestation_id": "ra-v1:97813d4132b579f859ec2f32a7891a21fe1a806159c3074dfce527ee514e1b2d",
  "request_nonce": "PUBLIC_REHEARSAL_AUTOGENERATED",
  "schema_version": "3.0.0-draft",
  "steps": [
    {
      "event_id": "EVENT-V2-01-RESET_AND_START",
      "operation": "RESET_AND_START",
      "roles": {},
      "session_id": "V2-SESSION-A",
      "step_id": "V2-01",
      "virtual_time": "2026-01-01T00:00:00Z"
    },
    {
      "event_id": "EVENT-V2-02-UPSERT_FACT",
      "operation": "UPSERT_FACT",
      "roles": {
        "CURRENT_AUTHORITY": "PUBLIC_AUTHORITY_V1",
        "ONE_OFF_VALUE": "PUBLIC_ONCE_MORNING",
        "PRESERVED_SCOPE": "PUBLIC_SCOPE_KEEP",
        "PRIMARY_GOAL": "v2-goal-beta",
        "STABLE_VALUE": "PUBLIC_STABLE_BLUE",
        "TARGET_ENTITY": "v2-entity-c"
      },
      "session_id": "V2-SESSION-A",
      "step_id": "V2-02",
      "virtual_time": "2026-01-01T00:01:00Z"
    },
    {
      "event_id": "EVENT-V2-03-ADVANCE_SESSION",
      "operation": "ADVANCE_SESSION",
      "roles": {
        "DISTRACTOR_ENTITY": "PUBLIC_ENTITY_A",
        "PRIMARY_GOAL": "v2-goal-beta",
        "TARGET_ENTITY": "v2-entity-c"
      },
      "session_id": "V2-SESSION-B",
      "step_id": "V2-03",
      "virtual_time": "2026-01-01T00:02:00Z"
    },
    {
      "event_id": "EVENT-V2-03B-UPSERT_FACT",
      "operation": "UPSERT_FACT",
      "roles": {
        "CURRENT_AUTHORITY": "PUBLIC_AUTHORITY_V9",
        "PRESERVED_SCOPE": "v2-scope-distractor-only",
        "STABLE_VALUE": "v2-stable-wrong-entity",
        "TARGET_ENTITY": "PUBLIC_ENTITY_A"
      },
      "session_id": "V2-SESSION-B",
      "step_id": "V2-03B",
      "virtual_time": "2026-01-01T00:02:30Z"
    },
    {
      "event_id": "EVENT-V2-04-REQUEST_DECISION",
      "operation": "REQUEST_DECISION",
      "roles": {
        "PRIMARY_GOAL": "v2-goal-beta",
        "TARGET_ENTITY": "v2-entity-c"
      },
      "session_id": "V2-SESSION-B",
      "step_id": "V2-04",
      "virtual_time": "2026-01-01T00:03:00Z"
    },
    {
      "event_id": "EVENT-V2-05-CORRECT_FACT",
      "operation": "CORRECT_FACT",
      "roles": {
        "CURRENT_AUTHORITY": "PUBLIC_AUTHORITY_V2",
        "ONE_OFF_VALUE": "PUBLIC_CORRECTED_GREEN",
        "PRESERVED_SCOPE": "PUBLIC_SCOPE_KEEP",
        "TARGET_ENTITY": "v2-entity-c"
      },
      "session_id": "V2-SESSION-B",
      "step_id": "V2-05",
      "virtual_time": "2026-01-01T00:04:00Z"
    },
    {
      "event_id": "EVENT-V2-06-REVOKE_SCOPE",
      "operation": "REVOKE_SCOPE",
      "roles": {
        "PRESERVED_SCOPE": "PUBLIC_SCOPE_KEEP",
        "REVOKED_SCOPE": "PUBLIC_SCOPE_REVOKE"
      },
      "session_id": "V2-SESSION-B",
      "step_id": "V2-06",
      "virtual_time": "2026-01-01T00:05:00Z"
    },
    {
      "event_id": "EVENT-V2-07-DELETE_FACT",
      "operation": "DELETE_FACT",
      "roles": {
        "TARGET_ENTITY": "v2-entity-c"
      },
      "session_id": "V2-SESSION-B",
      "step_id": "V2-07",
      "virtual_time": "2026-01-01T00:06:00Z"
    },
    {
      "event_id": "EVENT-V2-08-SET_NETWORK",
      "operation": "SET_NETWORK",
      "roles": {
        "NETWORK_STATE": "OFFLINE",
        "ONE_OFF_VALUE": "OFFLINE"
      },
      "session_id": "V2-SESSION-B",
      "step_id": "V2-08",
      "virtual_time": "2026-01-01T00:07:00Z"
    },
    {
      "event_id": "EVENT-V2-09-PROCESS_KILL_RELAUNCH",
      "operation": "PROCESS_KILL_RELAUNCH",
      "roles": {},
      "session_id": "V2-SESSION-C",
      "step_id": "V2-09",
      "virtual_time": "2026-01-01T00:08:00Z"
    },
    {
      "event_id": "EVENT-V2-10-REPLAY_EVENT",
      "operation": "REPLAY_EVENT",
      "roles": {
        "REPLAY_OF_EVENT_ID": "EVENT-V2-04-REQUEST_DECISION"
      },
      "session_id": "V2-SESSION-C",
      "step_id": "V2-10",
      "virtual_time": "2026-01-01T00:09:00Z"
    },
    {
      "event_id": "EVENT-V2-11-DELIVER_OUT_OF_ORDER",
      "operation": "DELIVER_OUT_OF_ORDER",
      "roles": {
        "CURRENT_AUTHORITY": "PUBLIC_AUTHORITY_V2",
        "OLDER_EVENT_ID": "EVENT-V2-02-UPSERT_FACT"
      },
      "session_id": "V2-SESSION-C",
      "step_id": "V2-11",
      "virtual_time": "2026-01-01T00:10:00Z"
    },
    {
      "event_id": "EVENT-V2-12-ADVANCE_TIME",
      "operation": "ADVANCE_TIME",
      "roles": {
        "DELAYED_OUTCOME": "PUBLIC_DELAYED_OUTCOME_ARRIVED"
      },
      "session_id": "V2-SESSION-C",
      "step_id": "V2-12",
      "virtual_time": "2026-01-08T00:10:00Z"
    },
    {
      "event_id": "EVENT-V2-13-EXPORT_AND_END",
      "operation": "EXPORT_AND_END",
      "roles": {},
      "session_id": "V2-SESSION-C",
      "step_id": "V2-13",
      "virtual_time": "2026-01-08T00:11:00Z"
    }
  ],
  "surface_nonce": "PUBLIC_REHEARSAL_SURFACE_A"
}
