{
  "candidate_id": "PUBLIC_REHEARSAL_AUTOMATIC",
  "content_class": "PUBLIC_REHEARSAL_NOT_OFFICIAL",
  "instance_id": "PUBLIC-REHEARSAL-AUTOMATIC-INSTANCE",
  "mission_id": "public-rehearsal-automatic",
  "operator_run_token": "PUBLIC_REHEARSAL_AUTOGENERATED",
  "probe_contract_profile": "DACON_SIGNED_RUNNER_PROTECTED_COMPONENT_V3_DRAFT",
  "probe_pack_id": "PUBLIC-REHEARSAL-13-OPS-V1-V1",
  "release_attestation_id": "ra-v1:97813d4132b579f859ec2f32a7891a21fe1a806159c3074dfce527ee514e1b2d",
  "request_nonce": "PUBLIC_REHEARSAL_AUTOGENERATED",
  "schema_version": "3.0.0-draft",
  "steps": [
    {
      "event_id": "EVENT-V1-01-OPAQUE",
      "operation": "RESET_AND_START",
      "roles": {},
      "session_id": "V1-SESSION-A",
      "step_id": "V1-01",
      "virtual_time": "2026-01-01T00:00:00Z"
    },
    {
      "event_id": "EVENT-V1-02-OPAQUE",
      "operation": "UPSERT_FACT",
      "roles": {
        "CURRENT_AUTHORITY": "v1-tok-00",
        "ONE_OFF_VALUE": "v1-tok-01",
        "PRESERVED_SCOPE": "v1-tok-02",
        "PRIMARY_GOAL": "v1-tok-03",
        "STABLE_VALUE": "v1-tok-04",
        "TARGET_ENTITY": "v1-tok-05"
      },
      "session_id": "V1-SESSION-A",
      "step_id": "V1-02",
      "virtual_time": "2026-01-01T00:01:00Z"
    },
    {
      "event_id": "EVENT-V1-03-OPAQUE",
      "operation": "ADVANCE_SESSION",
      "roles": {
        "DISTRACTOR_ENTITY": "v1-tok-06",
        "PRIMARY_GOAL": "v1-tok-03",
        "TARGET_ENTITY": "v1-tok-05"
      },
      "session_id": "V1-SESSION-B",
      "step_id": "V1-03",
      "virtual_time": "2026-01-01T00:02:00Z"
    },
    {
      "event_id": "EVENT-V1-04-OPAQUE",
      "operation": "REQUEST_DECISION",
      "roles": {
        "PRIMARY_GOAL": "v1-tok-03",
        "TARGET_ENTITY": "v1-tok-05"
      },
      "session_id": "V1-SESSION-B",
      "step_id": "V1-04",
      "virtual_time": "2026-01-01T00:03:00Z"
    },
    {
      "event_id": "EVENT-V1-05-OPAQUE",
      "operation": "CORRECT_FACT",
      "roles": {
        "CURRENT_AUTHORITY": "v1-tok-07",
        "ONE_OFF_VALUE": "v1-tok-08",
        "PRESERVED_SCOPE": "v1-tok-02",
        "TARGET_ENTITY": "v1-tok-05"
      },
      "session_id": "V1-SESSION-B",
      "step_id": "V1-05",
      "virtual_time": "2026-01-01T00:04:00Z"
    },
    {
      "event_id": "EVENT-V1-06-OPAQUE",
      "operation": "REVOKE_SCOPE",
      "roles": {
        "PRESERVED_SCOPE": "v1-tok-02",
        "REVOKED_SCOPE": "v1-tok-09"
      },
      "session_id": "V1-SESSION-B",
      "step_id": "V1-06",
      "virtual_time": "2026-01-01T00:05:00Z"
    },
    {
      "event_id": "EVENT-V1-07-OPAQUE",
      "operation": "DELETE_FACT",
      "roles": {
        "TARGET_ENTITY": "v1-tok-05"
      },
      "session_id": "V1-SESSION-B",
      "step_id": "V1-07",
      "virtual_time": "2026-01-01T00:06:00Z"
    },
    {
      "event_id": "EVENT-V1-08-OPAQUE",
      "operation": "SET_NETWORK",
      "roles": {
        "NETWORK_STATE": "OFFLINE",
        "ONE_OFF_VALUE": "v1-tok-10"
      },
      "session_id": "V1-SESSION-B",
      "step_id": "V1-08",
      "virtual_time": "2026-01-01T00:07:00Z"
    },
    {
      "event_id": "EVENT-V1-09-OPAQUE",
      "operation": "PROCESS_KILL_RELAUNCH",
      "roles": {},
      "session_id": "V1-SESSION-C",
      "step_id": "V1-09",
      "virtual_time": "2026-01-01T00:08:00Z"
    },
    {
      "event_id": "EVENT-V1-10-OPAQUE",
      "operation": "REPLAY_EVENT",
      "roles": {
        "REPLAY_OF_EVENT_ID": "EVENT-V1-04-OPAQUE"
      },
      "session_id": "V1-SESSION-C",
      "step_id": "V1-10",
      "virtual_time": "2026-01-01T00:09:00Z"
    },
    {
      "event_id": "EVENT-V1-11-OPAQUE",
      "operation": "DELIVER_OUT_OF_ORDER",
      "roles": {
        "CURRENT_AUTHORITY": "v1-tok-07",
        "OLDER_EVENT_ID": "EVENT-V1-02-OPAQUE"
      },
      "session_id": "V1-SESSION-C",
      "step_id": "V1-11",
      "virtual_time": "2026-01-01T00:10:00Z"
    },
    {
      "event_id": "EVENT-V1-12-OPAQUE",
      "operation": "ADVANCE_TIME",
      "roles": {
        "DELAYED_OUTCOME": "v1-tok-11"
      },
      "session_id": "V1-SESSION-C",
      "step_id": "V1-12",
      "virtual_time": "2026-01-08T00:10:00Z"
    },
    {
      "event_id": "EVENT-V1-13-OPAQUE",
      "operation": "EXPORT_AND_END",
      "roles": {},
      "session_id": "V1-SESSION-C",
      "step_id": "V1-13",
      "virtual_time": "2026-01-08T00:11:00Z"
    }
  ],
  "surface_nonce": "PUBLIC_REHEARSAL_SURFACE_A"
}
