{
  "schema_version": "3.0.0-draft",
  "content_class": "PUBLIC_REHEARSAL_NOT_OFFICIAL",
  "probe_contract_profile": "DACON_SIGNED_RUNNER_PROTECTED_COMPONENT_V3_DRAFT",
  "probe_pack_id": "PUBLIC-EXAMPLE-MINIMAL-01",
  "instance_id": "PUBLIC-EXAMPLE-MINIMAL-01-INSTANCE-A",
  "request_nonce": "PUBLIC_NONCE_0001",
  "operator_run_token": "PUBLIC_REFERENCE_01",
  "candidate_id": "EXAMPLE_ONLY",
  "mission_id": "example-weekly-plan",
  "release_attestation_id": "ra-v1:2036053b4cdfe780d15be633acd3ccac8d1c4890728747aa2a9f60d45edddf0a",
  "surface_nonce": "PUBLIC_SURFACE_A",
  "steps": [
    {
      "step_id": "PUBLIC-01",
      "operation": "RESET_AND_START",
      "session_id": "SESSION-A",
      "virtual_time": "2026-01-01T00:00:00Z",
      "event_id": "EVENT-PUBLIC-RESET-01",
      "roles": {}
    },
    {
      "step_id": "PUBLIC-02",
      "operation": "UPSERT_FACT",
      "session_id": "SESSION-A",
      "virtual_time": "2026-01-01T00:01:00Z",
      "event_id": "EVENT-PUBLIC-FACT-01",
      "roles": {
        "PRIMARY_GOAL": "PUBLIC_GOAL_ALPHA",
        "TARGET_ENTITY": "PUBLIC_ENTITY_A",
        "STABLE_VALUE": "PUBLIC_STABLE_BLUE",
        "ONE_OFF_VALUE": "PUBLIC_ONCE_MORNING",
        "CURRENT_AUTHORITY": "PUBLIC_AUTHORITY_V1"
      }
    },
    {
      "step_id": "PUBLIC-03",
      "operation": "REQUEST_DECISION",
      "session_id": "SESSION-A",
      "virtual_time": "2026-01-01T00:02:00Z",
      "event_id": "EVENT-PUBLIC-DECISION-01",
      "roles": {
        "PRIMARY_GOAL": "PUBLIC_GOAL_ALPHA",
        "TARGET_ENTITY": "PUBLIC_ENTITY_A"
      }
    },
    {
      "step_id": "PUBLIC-04",
      "operation": "PROCESS_KILL_RELAUNCH",
      "session_id": "SESSION-B",
      "virtual_time": "2026-01-01T00:03:00Z",
      "event_id": "EVENT-PUBLIC-KILL-01",
      "roles": {}
    },
    {
      "step_id": "PUBLIC-05",
      "operation": "EXPORT_AND_END",
      "session_id": "SESSION-B",
      "virtual_time": "2026-01-01T00:04:00Z",
      "event_id": "EVENT-PUBLIC-EXPORT-01",
      "roles": {}
    }
  ]
}
