{
  "candidate_id": "PUBLIC_REHEARSAL_AUTOMATIC",
  "content_class": "PUBLIC_REHEARSAL_NOT_OFFICIAL",
  "instance_id": "PUBLIC-REHEARSAL-AUTOMATIC-INSTANCE",
  "mission_id": "public-rehearsal-automatic",
  "operator_run_token": "PUBLIC_REHEARSAL_AUTOGENERATED",
  "probe_contract_profile": "DACON_SIGNED_RUNNER_PROTECTED_COMPONENT_V3_DRAFT",
  "probe_pack_id": "PUBLIC-REHEARSAL-13-OPS-V1-V4",
  "release_attestation_id": "ra-v1:97813d4132b579f859ec2f32a7891a21fe1a806159c3074dfce527ee514e1b2d",
  "request_nonce": "PUBLIC_REHEARSAL_AUTOGENERATED",
  "schema_version": "3.0.0-draft",
  "steps": [
    {
      "event_id": "EVENT-V4-01-RESET_AND_START",
      "operation": "RESET_AND_START",
      "roles": {},
      "session_id": "V4-SESSION-A",
      "step_id": "V4-01",
      "virtual_time": "2026-02-01T00:01:00Z"
    },
    {
      "event_id": "EVENT-V4-02-UPSERT_FACT",
      "operation": "UPSERT_FACT",
      "roles": {
        "CURRENT_AUTHORITY": "v4-authority-v1",
        "DELAYED_OUTCOME": "v4-outcome-scheduled",
        "EPHEMERAL_VALUE": "v4-ephemeral-request",
        "ONE_OFF_VALUE": "v4-once",
        "PRESERVED_SCOPE": "v4-scope-keep",
        "PRIMARY_GOAL": "v4-goal",
        "STABLE_VALUE": "v4-stable",
        "TARGET_ENTITY": "v4-entity"
      },
      "session_id": "V4-SESSION-A",
      "step_id": "V4-02",
      "virtual_time": "2026-02-01T00:02:00Z"
    },
    {
      "event_id": "EVENT-V4-03-REQUEST_DECISION",
      "operation": "REQUEST_DECISION",
      "roles": {
        "PRIMARY_GOAL": "v4-goal",
        "TARGET_ENTITY": "v4-entity"
      },
      "session_id": "V4-SESSION-A",
      "step_id": "V4-03",
      "virtual_time": "2026-02-01T00:03:00Z"
    },
    {
      "event_id": "EVENT-V4-04-REQUEST_DECISION",
      "operation": "REQUEST_DECISION",
      "roles": {
        "PRIMARY_GOAL": "v4-goal",
        "TARGET_ENTITY": "v4-entity"
      },
      "session_id": "V4-SESSION-A",
      "step_id": "V4-04",
      "virtual_time": "2026-02-01T00:04:00Z"
    },
    {
      "event_id": "EVENT-V4-05-ADVANCE_SESSION",
      "operation": "ADVANCE_SESSION",
      "roles": {
        "PRIMARY_GOAL": "v4-goal",
        "TARGET_ENTITY": "v4-entity"
      },
      "session_id": "V4-SESSION-B",
      "step_id": "V4-05",
      "virtual_time": "2026-02-01T00:05:00Z"
    },
    {
      "event_id": "EVENT-V4-06-REQUEST_DECISION",
      "operation": "REQUEST_DECISION",
      "roles": {
        "PRIMARY_GOAL": "v4-goal",
        "TARGET_ENTITY": "v4-entity"
      },
      "session_id": "V4-SESSION-B",
      "step_id": "V4-06",
      "virtual_time": "2026-02-01T00:06:00Z"
    },
    {
      "event_id": "EVENT-V4-07-CORRECT_FACT",
      "operation": "CORRECT_FACT",
      "roles": {
        "CURRENT_AUTHORITY": "v4-authority-v2",
        "ONE_OFF_VALUE": "v4-corrected",
        "PRESERVED_SCOPE": "v4-scope-keep",
        "TARGET_ENTITY": "v4-entity"
      },
      "session_id": "V4-SESSION-B",
      "step_id": "V4-07",
      "virtual_time": "2026-02-01T00:07:00Z"
    },
    {
      "event_id": "EVENT-V4-08-REQUEST_DECISION",
      "operation": "REQUEST_DECISION",
      "roles": {
        "PRIMARY_GOAL": "v4-goal",
        "TARGET_ENTITY": "v4-entity"
      },
      "session_id": "V4-SESSION-B",
      "step_id": "V4-08",
      "virtual_time": "2026-02-01T00:08:00Z"
    },
    {
      "event_id": "EVENT-V4-09-REVOKE_SCOPE",
      "operation": "REVOKE_SCOPE",
      "roles": {
        "PRESERVED_SCOPE": "v4-scope-keep",
        "REVOKED_SCOPE": "v4-scope-revoke"
      },
      "session_id": "V4-SESSION-B",
      "step_id": "V4-09",
      "virtual_time": "2026-02-01T00:09:00Z"
    },
    {
      "event_id": "EVENT-V4-10-REQUEST_DECISION",
      "operation": "REQUEST_DECISION",
      "roles": {
        "PRIMARY_GOAL": "v4-goal",
        "TARGET_ENTITY": "v4-entity"
      },
      "session_id": "V4-SESSION-B",
      "step_id": "V4-10",
      "virtual_time": "2026-02-01T00:10:00Z"
    },
    {
      "event_id": "EVENT-V4-11-SET_NETWORK",
      "operation": "SET_NETWORK",
      "roles": {
        "NETWORK_STATE": "DELAYED"
      },
      "session_id": "V4-SESSION-B",
      "step_id": "V4-11",
      "virtual_time": "2026-02-01T00:11:00Z"
    },
    {
      "event_id": "EVENT-V4-12-REQUEST_DECISION",
      "operation": "REQUEST_DECISION",
      "roles": {
        "PRIMARY_GOAL": "v4-goal",
        "TARGET_ENTITY": "v4-entity"
      },
      "session_id": "V4-SESSION-B",
      "step_id": "V4-12",
      "virtual_time": "2026-02-01T00:12:00Z"
    },
    {
      "event_id": "EVENT-V4-13-SET_NETWORK",
      "operation": "SET_NETWORK",
      "roles": {
        "NETWORK_STATE": "OFFLINE"
      },
      "session_id": "V4-SESSION-B",
      "step_id": "V4-13",
      "virtual_time": "2026-02-01T00:13:00Z"
    },
    {
      "event_id": "EVENT-V4-14-REQUEST_DECISION",
      "operation": "REQUEST_DECISION",
      "roles": {
        "PRIMARY_GOAL": "v4-goal",
        "TARGET_ENTITY": "v4-entity"
      },
      "session_id": "V4-SESSION-B",
      "step_id": "V4-14",
      "virtual_time": "2026-02-01T00:14:00Z"
    },
    {
      "event_id": "EVENT-V4-15-SET_NETWORK",
      "operation": "SET_NETWORK",
      "roles": {
        "NETWORK_STATE": "ONLINE"
      },
      "session_id": "V4-SESSION-B",
      "step_id": "V4-15",
      "virtual_time": "2026-02-01T00:15:00Z"
    },
    {
      "event_id": "EVENT-V4-16-REQUEST_DECISION",
      "operation": "REQUEST_DECISION",
      "roles": {
        "PRIMARY_GOAL": "v4-goal",
        "TARGET_ENTITY": "v4-entity"
      },
      "session_id": "V4-SESSION-B",
      "step_id": "V4-16",
      "virtual_time": "2026-02-01T00:16:00Z"
    },
    {
      "event_id": "EVENT-V4-17-UPSERT_FACT",
      "operation": "UPSERT_FACT",
      "roles": {
        "CURRENT_AUTHORITY": "v4-authority-v3",
        "PRESERVED_SCOPE": "v4-scope-side",
        "STABLE_VALUE": "v4-side-out-of-stock",
        "TARGET_ENTITY": "v4-entity"
      },
      "session_id": "V4-SESSION-B",
      "step_id": "V4-17",
      "virtual_time": "2026-02-01T00:17:00Z"
    },
    {
      "event_id": "EVENT-V4-18-REQUEST_DECISION",
      "operation": "REQUEST_DECISION",
      "roles": {
        "PRIMARY_GOAL": "v4-goal",
        "TARGET_ENTITY": "v4-entity"
      },
      "session_id": "V4-SESSION-B",
      "step_id": "V4-18",
      "virtual_time": "2026-02-01T00:18:00Z"
    },
    {
      "event_id": "EVENT-V4-19-ADVANCE_TIME",
      "operation": "ADVANCE_TIME",
      "roles": {
        "DELAYED_OUTCOME": "v4-outcome-scheduled"
      },
      "session_id": "V4-SESSION-B",
      "step_id": "V4-19",
      "virtual_time": "2026-02-01T00:19:00Z"
    },
    {
      "event_id": "EVENT-V4-20-REQUEST_DECISION",
      "operation": "REQUEST_DECISION",
      "roles": {
        "PRIMARY_GOAL": "v4-goal",
        "TARGET_ENTITY": "v4-entity"
      },
      "session_id": "V4-SESSION-B",
      "step_id": "V4-20",
      "virtual_time": "2026-02-01T00:20:00Z"
    },
    {
      "event_id": "EVENT-V4-21-PROCESS_KILL_RELAUNCH",
      "operation": "PROCESS_KILL_RELAUNCH",
      "roles": {},
      "session_id": "V4-SESSION-C",
      "step_id": "V4-21",
      "virtual_time": "2026-02-01T00:21:00Z"
    },
    {
      "event_id": "EVENT-V4-22-REQUEST_DECISION",
      "operation": "REQUEST_DECISION",
      "roles": {
        "PRIMARY_GOAL": "v4-goal",
        "TARGET_ENTITY": "v4-entity"
      },
      "session_id": "V4-SESSION-C",
      "step_id": "V4-22",
      "virtual_time": "2026-02-01T00:22:00Z"
    },
    {
      "event_id": "EVENT-V4-23-REPLAY_EVENT",
      "operation": "REPLAY_EVENT",
      "roles": {
        "REPLAY_OF_EVENT_ID": "EVENT-V4-03-REQUEST_DECISION"
      },
      "session_id": "V4-SESSION-C",
      "step_id": "V4-23",
      "virtual_time": "2026-02-01T00:23:00Z"
    },
    {
      "event_id": "EVENT-V4-24-DELIVER_OUT_OF_ORDER",
      "operation": "DELIVER_OUT_OF_ORDER",
      "roles": {
        "CURRENT_AUTHORITY": "v4-authority-v1",
        "OLDER_EVENT_ID": "EVENT-V4-02-UPSERT_FACT"
      },
      "session_id": "V4-SESSION-C",
      "step_id": "V4-24",
      "virtual_time": "2026-02-01T00:24:00Z"
    },
    {
      "event_id": "EVENT-V4-25-DELETE_FACT",
      "operation": "DELETE_FACT",
      "roles": {
        "EPHEMERAL_VALUE": "v4-ephemeral-request",
        "TARGET_ENTITY": "v4-entity"
      },
      "session_id": "V4-SESSION-C",
      "step_id": "V4-25",
      "virtual_time": "2026-02-01T00:25:00Z"
    },
    {
      "event_id": "EVENT-V4-26-EXPORT_AND_END",
      "operation": "EXPORT_AND_END",
      "roles": {},
      "session_id": "V4-SESSION-C",
      "step_id": "V4-26",
      "virtual_time": "2026-02-01T00:26:00Z"
    }
  ],
  "surface_nonce": "PUBLIC_REHEARSAL_SURFACE_A"
}
